{
  "$schema": "https://json-schema.org/draft/2020-12/schema",
  "title": "getbrolls analysis visual v1",
  "$id": "https://raw.githubusercontent.com/engenheirodevideo/get-brolls/v2.6.0/schemas/visual.schema.json",
  "description": "analysis/media/<media_id>/visual.json: amostras visuais com etiquetas. human_reviewed diz se uma pessoa conferiu; evidência automática nunca vale como revisão. Schema mínimo, sem producer. Objetos abertos: campo novo opcional entra fora de required e o leitor ignora chave desconhecida; remover, renomear ou mudar o significado de um campo sobe o N de schema. Leitor recusa N maior do que conhece.",
  "type": "object",
  "required": [
    "schema",
    "media_id",
    "status",
    "reason",
    "created",
    "time_unit",
    "human_reviewed",
    "evidence_type",
    "samples"
  ],
  "properties": {
    "schema": {
      "const": "getbrolls.visual/1"
    },
    "media_id": {
      "type": "string",
      "pattern": "^[0-9a-f]{16}$",
      "description": "Primeiros 16 hex do sha256 dos bytes da mídia (o asset_id do contrato de ingest externo tem a mesma derivação)."
    },
    "status": {
      "enum": [
        "done",
        "done_partial",
        "unavailable",
        "failed",
        "blocked",
        "not_run_by_this_script",
        "no_speech"
      ],
      "description": "Estado do componente. unavailable, failed, blocked e not_run_by_this_script exigem reason (conferido em código)."
    },
    "reason": {
      "type": [
        "string",
        "null"
      ],
      "maxLength": 2000
    },
    "created": {
      "type": "string",
      "pattern": "^[0-9]{4}-[0-9]{2}-[0-9]{2}T[0-9]{2}:[0-9]{2}:[0-9]{2}(\\.[0-9]{1,6})?(Z|[+-][0-9]{2}:[0-9]{2})$"
    },
    "time_unit": {
      "const": "s"
    },
    "human_reviewed": {
      "type": "boolean"
    },
    "evidence_type": {
      "type": "string",
      "pattern": "^[a-z][a-z0-9_]{0,31}$"
    },
    "samples": {
      "type": "array",
      "items": {
        "type": "object",
        "required": [
          "time",
          "tags",
          "description",
          "objects"
        ],
        "properties": {
          "time": {
            "type": "number",
            "minimum": 0,
            "description": "Segundos (time_unit s), número finito (NaN e infinito recusados em código)."
          },
          "tags": {
            "type": "array",
            "items": {
              "type": "string",
              "minLength": 1,
              "maxLength": 64
            }
          },
          "description": {
            "type": [
              "string",
              "null"
            ],
            "maxLength": 2000
          },
          "objects": {
            "type": "array",
            "items": {
              "type": "string",
              "minLength": 1,
              "maxLength": 64
            }
          }
        }
      }
    }
  }
}
