{"schema": "getbrolls.visual/1", "media_id": "9f86d081884c7d65", "status": "done", "reason": null, "created": "2026-09-30T12:00:00.000000+00:00", "time_unit": "s",
 "human_reviewed": false, "evidence_type": "auto_vision",
 "samples": [{"time": 1.0, "tags": ["rua"], "description": null, "objects": []}]}
